Partida,Data,Mercado,Probabilidade,Odd Esperada,Odd Ofertada
Persik Kediri vs Persebaya Surabaya,Friday October 27,Under 3.5,81%,1.23,1.47
Kryvbas KR U19 vs Dnipro-1 U19,Friday October 27,Over 2.5,70%,1.43,1.68
GFA vs Kachin United,Friday October 27,9.5+ Corners,73%,1.37,1.95
Kara-Balta vs Ilbirs,Friday October 27,Under 1.5,28%,3.57,6.50
Kara-Balta vs Ilbirs,Friday October 27,Under 3.5,61%,1.64,1.97
Kara-Balta vs Ilbirs,Friday October 27,Under 4.5,85%,1.18,1.42
Podillya Khmelnytskyi vs Ahrobiznes Volochysk,Friday October 27,Under 2.5,84%,1.19,1.57
Podillya Khmelnytskyi vs Ahrobiznes Volochysk,Friday October 27,Under 3.5,100%,1,1.20
Barito Putera vs PS TNI,Friday October 27,Under 3.5,79%,1.27,1.52
BEC Tero Sasana vs Khon Kaen United,Friday October 27,Over 4.5,35%,2.86,4.33
BEC Tero Sasana vs Khon Kaen United,Friday October 27,BTTS %,75%,1.33,1.57
BEC Tero Sasana vs Khon Kaen United,Friday October 27,8.5+ Corners,80%,1.25,1.64
BEC Tero Sasana vs Khon Kaen United,Friday October 27,9.5+ Corners,60%,1.67,2.04
BEC Tero Sasana vs Khon Kaen United,Friday October 27,10.5+ Corners,48%,2.08,2.64
Igman Konjic vs Željezničar,Friday October 27,Over 2.5,60%,1.67,2.05
Kukësi vs Vllaznia Shkodër,Friday October 27,Under 4.5,100%,1,1.15
Olimpia Râmnicu Sărat vs CSM Focsani,Friday October 27,Over 3.5,56%,1.79,2.30
Olimpia Râmnicu Sărat vs CSM Focsani,Friday October 27,Over 4.5,39%,2.56,3.70
Minerul Ocna Dej vs Victoria Carei,Friday October 27,Over 2.5,78%,1.28,1.52
ACS Gloria Bistrita vs Viitorul Cluj,Friday October 27,Under 3.5,67%,1.49,1.81
CSM Râmnicu Vâlcea vs Sporting Roşiori,Friday October 27,Over 4.5,39%,2.56,4.20
Unirea Bascov vs Viitorul Dăești,Friday October 27,Over 4.5,39%,2.56,4.20
PDRM vs Kuala Lumpur,Friday October 27,Under 3.5,73%,1.37,1.61
PDRM vs Kuala Lumpur,Friday October 27,10.5+ Corners,45%,2.22,3.10
Termez Surkhon vs Navbahor,Friday October 27,Over 2.5,52%,1.92,2.43
Dubrava Zagreb vs Orijent 1919,Friday October 27,Over 4.5,30%,3.33,6.50
Dubrava Zagreb vs Orijent 1919,Friday October 27,BTTS %,80%,1.25,1.64
Dugopolje U19 vs Sesvete U19,Friday October 27,9.5+ Corners,70%,1.43,2.20
Gorilla vs Marines,Friday October 27,Under 0.5,50%,2,8.00
Gorilla vs Marines,Friday October 27,Under 1.5,67%,1.49,2.84
Gorilla vs Marines,Friday October 27,9.5+ Corners,84%,1.19,2.00
Mes Kerman vs Esteghlal Mollasani,Friday October 27,Under 0.5,38%,2.63,5.70
Darya Babol vs Shahrdari Astara,Friday October 27,Over 0.5,100%,1,1.15
Darya Babol vs Shahrdari Astara,Friday October 27,Over 2.5,50%,2,3.15
Darya Babol vs Shahrdari Astara,Friday October 27,BTTS %,63%,1.59,2.54
Fajr Sepasi vs Khalij Fars,Friday October 27,Over 1.5,88%,1.14,1.48
Fajr Sepasi vs Khalij Fars,Friday October 27,Over 4.5,25%,4,8.80
Nasaf vs Metalourg,Friday October 27,Under 1.5,46%,2.17,3.00
CSKA Sofia vs Arda,Friday October 27,Under 2.5,92%,1.09,1.65
CSKA Sofia vs Arda,Friday October 27,Under 3.5,92%,1.09,1.25
Spartak Vladikavkaz vs Arsenal Tula,Friday October 27,Under 3.5,93%,1.08,1.23
Marumo Gallants vs Baroka,Friday October 27,Under 1.5,63%,1.59,2.40
Marumo Gallants vs Baroka,Friday October 27,Under 2.5,88%,1.14,1.47
Voluntari vs Sepsi,Friday October 27,Over 2.5,70%,1.43,2.30
Alverca U19 vs Benfica U19,Friday October 27,Over 2.5,88%,1.14,1.40
Be1 NFA vs Jonava,Friday October 27,Under 3.5,70%,1.43,1.71
Be1 NFA vs Jonava,Friday October 27,BTTS %,62%,1.61,1.93
Panevėžys II vs Kauno Žalgiris II,Friday October 27,Under 2.5,53%,1.89,2.64
Panevėžys II vs Kauno Žalgiris II,Friday October 27,Under 3.5,82%,1.22,1.69
Panevėžys II vs Kauno Žalgiris II,Friday October 27,Under 4.5,89%,1.12,1.27
