Partida,Data,Mercado,Probabilidade,Odd Esperada,Odd Ofertada
Ankara Demirspor vs Van BB,Tuesday December 19,Over 2.5,57%,1.75,2.25
Al Karkh vs Al Hudod,Tuesday December 19,Over 4.5,25%,4,7.00
Kheybar Khorramabad vs Shahre Raz,Tuesday December 19,Under 1.5,59%,1.69,2.21
Talasgücü Belediyespor vs Arguvan Belediyespor,Tuesday December 19,Under 3.5,93%,1.08,1.22
Arnavutköy Belediyespor vs İnegölspor,Tuesday December 19,9.5+ Corners,58%,1.72,2.38
Utaş Uşakspor vs Denizlispor,Tuesday December 19,Under 2.5,66%,1.52,1.85
Aluminium Arak vs Gol Gohar,Tuesday December 19,Under 2.5,90%,1.11,1.30
Shams Azar Qazvin vs Sanat Naft,Tuesday December 19,Over 1.5,100%,1,1.54
Shams Azar Qazvin vs Sanat Naft,Tuesday December 19,Over 2.5,80%,1.25,2.55
Shams Azar Qazvin vs Sanat Naft,Tuesday December 19,Over 3.5,40%,2.5,4.80
Shams Azar Qazvin vs Sanat Naft,Tuesday December 19,BTTS %,90%,1.11,2.25
Esteghlal Khuzestan vs Persepolis,Tuesday December 19,BTTS %,44%,2.27,3.90
Naft Maysan vs Newroz SC,Tuesday December 19,Under 2.5,78%,1.28,1.53
Naft Maysan vs Newroz SC,Tuesday December 19,Under 3.5,100%,1,1.16
Telecom Egypt SC vs Tanta SC,Tuesday December 19,Over 2.5,67%,1.49,2.00
Nogoom El Mostakbal FC vs Petrojet,Tuesday December 19,Over 2.5,67%,1.49,2.25
Benfica U23 vs Mafra U23,Tuesday December 19,Over 3.5,58%,1.72,2.20
Benfica U23 vs Mafra U23,Tuesday December 19,Over 4.5,42%,2.38,3.30
Ipswich Town U21 vs Bristol City U21,Tuesday December 19,9.5+ Corners,68%,1.47,2.10
Al Hussein vs Sahab,Tuesday December 19,Under 2.5,58%,1.72,2.20
Al Hussein vs Sahab,Tuesday December 19,8.5+ Corners,68%,1.47,1.93
Zob Ahan vs Foolad,Tuesday December 19,Over 1.5,72%,1.39,1.77
Zob Ahan vs Foolad,Tuesday December 19,Over 2.5,44%,2.27,3.00
Magesi vs Upington City,Tuesday December 19,Under 2.5,88%,1.14,1.61
Milford vs Black Leopards,Tuesday December 19,Under 2.5,81%,1.23,1.53
University of Pretoria vs Orbit College,Tuesday December 19,9.5+ Corners,70%,1.43,2.38
University of Pretoria vs Orbit College,Tuesday December 19,10.5+ Corners,62%,1.61,2.45
Sheffield Wednesday U21 vs Birmingham City U21,Tuesday December 19,Under 4.5,100%,1,1.31
Sheffield Wednesday U21 vs Birmingham City U21,Tuesday December 19,9.5+ Corners,83%,1.2,2.38
Sheffield Wednesday U21 vs Birmingham City U21,Tuesday December 19,10.5+ Corners,67%,1.49,2.09
İstanbul Başakşehir vs Sivasspor,Tuesday December 19,Over 4.5,27%,3.7,7.32
Giresunspor vs Gençlerbirliği,Tuesday December 19,Under 1.5,58%,1.72,3.40
Giresunspor vs Gençlerbirliği,Tuesday December 19,Under 2.5,72%,1.39,1.80
Naft Al-Wasat vs Al Minaa Basra,Tuesday December 19,Under 1.5,63%,1.59,2.40
Rio Ave U23 vs Gil Vicente U23,Tuesday December 19,Under 1.5,50%,2,3.65
Rio Ave U23 vs Gil Vicente U23,Tuesday December 19,8.5+ Corners,84%,1.19,1.66
Rio Ave U23 vs Gil Vicente U23,Tuesday December 19,9.5+ Corners,67%,1.49,2.06
Sporting Braga U23 vs Leixões U23,Tuesday December 19,BTTS %,67%,1.49,1.80
Torreense U23 vs Academico Viseu U23,Tuesday December 19,Over 3.5,42%,2.38,3.25
Torreense U23 vs Academico Viseu U23,Tuesday December 19,9.5+ Corners,84%,1.19,2.20
Torreense U23 vs Academico Viseu U23,Tuesday December 19,10.5+ Corners,58%,1.72,2.20
Portimonense U23 vs Estrela U23,Tuesday December 19,Over 3.5,50%,2,2.84
Aqaba vs Al Wihdat,Tuesday December 19,Over 2.5,57%,1.75,2.15
Aqaba vs Al Wihdat,Tuesday December 19,Over 3.5,47%,2.13,3.74
Busaiteen vs Al-Hidd,Tuesday December 19,Over 1.5,88%,1.14,1.33
Busaiteen vs Al-Hidd,Tuesday December 19,Over 2.5,75%,1.33,2.00
Busaiteen vs Al-Hidd,Tuesday December 19,BTTS %,88%,1.14,1.83
Manama vs Al Najma,Tuesday December 19,Over 1.5,88%,1.14,1.33
Zagłębie Sosnowiec vs Chrobry Głogów,Tuesday December 19,Over 3.5,38%,2.63,4.00
Zagłębie Sosnowiec vs Chrobry Głogów,Tuesday December 19,BTTS %,63%,1.59,1.91
