Partida,Data,Mercado,Probabilidade,Odd Esperada,Odd Ofertada
Proxy vs Al Nasr Taa'den,Monday November 20,Over 2.5,88%,1.14,1.89
Potencia vs Cerrito,Monday November 20,BTTS %,67%,1.49,1.80
Sama Al Sarhan vs Al Sareeh,Monday November 20,9.5+ Corners,63%,1.59,2.38
Amman vs Sama,Monday November 20,Under 2.5,75%,1.33,1.67
Birmingham City U21 vs Burnley U21,Monday November 20,Over 3.5,54%,1.85,2.29
Great Olympics vs Samartex,Monday November 20,Under 1.5,70%,1.43,2.09
Mouna vs Stade d'Abidjan,Monday November 20,Under 2.5,80%,1.25,1.44
Fenerbahçe W vs Beşiktaş W,Monday November 20,Under 2.5,78%,1.28,2.50
Fenerbahçe W vs Beşiktaş W,Monday November 20,Under 3.5,78%,1.28,1.55
Necaxa II vs Real Magari,Monday November 20,Under 2.5,50%,2,7.00
Vis Pesaro vs Sassari Torres,Monday November 20,10.5+ Corners,54%,1.85,2.80
San-Pédro vs SOL,Monday November 20,Under 1.5,50%,2,2.71
San-Pédro vs SOL,Monday November 20,8.5+ Corners,71%,1.41,1.85
Queens Park Rangers U21 vs AFC Bournemouth U21,Monday November 20,Under 2.5,40%,2.5,3.50
Queens Park Rangers U21 vs AFC Bournemouth U21,Monday November 20,9.5+ Corners,80%,1.25,2.00
Fénix vs Nacional,Monday November 20,Under 0.5,23%,4.35,8.00
Northern Ireland vs Denmark,Monday November 20,Under 1.5,39%,2.56,3.70
San Marino vs Finland,Monday November 20,Under 3.5,62%,1.61,2.10
San Marino vs Finland,Monday November 20,Under 4.5,89%,1.12,1.47
Levante UD vs Racing Santander,Monday November 20,Over 1.5,93%,1.08,1.26
Levante UD vs Racing Santander,Monday November 20,BTTS %,71%,1.41,1.73
Defensor Sporting vs Boston River,Monday November 20,8.5+ Corners,81%,1.23,1.42
Defensor Sporting vs Boston River,Monday November 20,9.5+ Corners,72%,1.39,1.90
